{
  "$schema": "http://json-schema.org/draft-07/schema#",
  "$id": "sv::dvrk_display_config@1.0.0",
  "title": "dvrk_display configuration",
  "description": "Configuration file for the dvrk_display node. Describes video sources, image geometry corrections, ROS publishing targets, and the GStreamer output sink.",
  "type": "object",
  "required": ["type", "left_stream", "right_stream"],
  "additionalProperties": false,
  "properties": {
    "type": {
      "type": "string",
      "const": "sv::dvrk_display_config@1.0.0",
      "description": "Schema type identifier. Must be exactly \"sv::dvrk_display_config@1.0.0\". The application validates this field on startup and refuses to load a file with a mismatched type."
    },
    "name": {
      "type": "string",
      "default": "dvrk_display",
      "description": "Name of the viewer instance. Used as the ROS node name and in log output."
    },
    "dvrk_console_namespace": {
      "type": "string",
      "default": "console",
      "description": "ROS namespace of the dVRK console. Used to discover teleop and PSM topics (e.g. /<namespace>/teleop/selected, /<namespace>/PSM1/measured_cp)."
    },
    "ros_image_publishers": {
      "type": "array",
      "default": [],
      "description": "List of ROS image streams to publish in addition to the display output. Each entry must be one of \"left\", \"right\", or \"stereo\". The combined stereo frame is available as \"stereo\".",
      "items": {
        "type": "string",
        "enum": ["left", "right", "stereo"]
      },
      "uniqueItems": true
    },
    "overlay_alpha": {
      "type": "number",
      "default": 0.7,
      "minimum": 0.0,
      "maximum": 1.0,
      "description": "Opacity of the HUD overlay drawn on top of the video (0 = fully transparent, 1 = fully opaque)."
    },
    "original_width": {
      "type": "integer",
      "minimum": 1,
      "description": "Native width of each camera frame in pixels before any cropping. Must be provided as a positive integer. Left and right streams must have identical dimensions."
    },
    "original_height": {
      "type": "integer",
      "minimum": 1,
      "description": "Native height of each camera frame in pixels before any cropping. Must be provided as a positive integer."
    },
    "crop_width": {
      "type": "integer",
      "minimum": 1,
      "description": "Width of the output region in pixels after applying the alignment shift and crop. Defaults to original_width when omitted."
    },
    "crop_height": {
      "type": "integer",
      "minimum": 1,
      "description": "Height of the output region in pixels after applying the alignment shift and crop. Defaults to original_height when omitted."
    },
    "horizontal_shift_px": {
      "type": "integer",
      "default": 0,
      "description": "Horizontal pixel offset applied to the right eye image relative to the left eye to correct stereo misalignment. Positive values shift the right image to the right."
    },
    "vertical_shift_px": {
      "type": "integer",
      "default": 0,
      "description": "Vertical pixel offset applied to the right eye image relative to the left eye to correct stereo misalignment. Positive values shift the right image down."
    },
    "left_stream": {
      "type": "string",
      "description": "GStreamer pipeline fragment for the left camera source. Must end with a raw video pad (video/x-raw). Example: \"v4l2src device=/dev/video0 ! video/x-raw,width=640,height=480,framerate=30/1\"."
    },
    "right_stream": {
      "type": "string",
      "description": "GStreamer pipeline fragment for the right camera source. Same format as left_stream. Must produce frames with the same dimensions and frame rate as left_stream."
    },
    "sink": {
      "type": "string",
      "enum": ["glimage", "custom"],
      "default": "glimage",
      "description": "Output sink type.\n  \"glimage\" (default) — uses \"glimagesink sync=false force-aspect-ratio=false\", suitable for GTK/OpenGL display.\n  \"custom\" — uses the string specified in the sink_stream field, allowing any GStreamer sink element."
    },
    "sink_stream": {
      "type": "string",
      "description": "GStreamer sink element string used when sink is set to \"custom\". Ignored when sink is \"glimage\". Example: \"fpsdisplaysink video-sink=glimagesink sync=false\"."
    },
    "unixfd_socket_path": {
      "type": "string",
      "description": "Filesystem path of the Unix file-descriptor socket used for zero-copy shared-memory transport (GStreamer unixfdsink/unixfdsrc). When set, the combined stereo frame is also published on this socket in addition to the normal display sink. Leave unset or empty to disable."
    }
  }
}
