{
  "type": "sv::dvrk_display_config@1.0.0",
  "name": "dvrk_display",
  "ros_image_publishers": ["stereo"],
  "dvrk_console_namespace": "console",
  "original_width": 640,
  "original_height": 480,
  "crop_width": 566,
  "crop_height": 425,
  "horizontal_shift_px": -73,
  "vertical_shift_px": -53,
  "left_stream": "videotestsrc pattern=ball is-live=true ! video/x-raw,width=640,height=480,framerate=30/1",
  "right_stream": "videotestsrc pattern=smpte is-live=true ! video/x-raw,width=640,height=480,framerate=30/1"
}
